{
  "description": "Sticky default is honoured even when a newer eligible release exists.",
  "registry": [
    {
      "wotid": "urn:example:pump:v1",
      "defaultversionsticky": true,
      "defaultversionid": "1.1.0",
      "versions": [
        {
          "versionid": "1.0.0",
          "versionorigin": "authored",
          "contentdigest": "sha256:0000000000000000000000000000000000000000000000000000000000000001",
          "version.model": "1.0.0"
        },
        {
          "versionid": "1.1.0",
          "versionorigin": "authored",
          "contentdigest": "sha256:0000000000000000000000000000000000000000000000000000000000000002",
          "version.model": "1.1.0"
        },
        {
          "versionid": "1.2.0",
          "versionorigin": "authored",
          "contentdigest": "sha256:0000000000000000000000000000000000000000000000000000000000000003",
          "version.model": "1.2.0"
        }
      ]
    }
  ],
  "reference": {
    "kind": "extends",
    "target": "urn:example:pump:v1",
    "minVersion": "1.0.0"
  },
  "expect": {
    "result": {
      "wotid": "urn:example:pump:v1",
      "versionid": "1.1.0",
      "contentdigest": "sha256:0000000000000000000000000000000000000000000000000000000000000002"
    }
  }
}
