{
  "description": "A sticky TD default outside the floor major fails instead of being replaced.",
  "registry": [
    {
      "wotid": "urn:example:thing:gateway",
      "defaultversionsticky": true,
      "defaultversionid": "2.2.0",
      "versions": [
        {
          "versionid": "1.8.0",
          "versionorigin": "authored",
          "contentdigest": "sha256:0000000000000000000000000000000000000000000000000000000000000039",
          "version.instance": "1.8.0"
        },
        {
          "versionid": "2.2.0",
          "versionorigin": "authored",
          "contentdigest": "sha256:000000000000000000000000000000000000000000000000000000000000003a",
          "version.instance": "2.2.0"
        }
      ]
    }
  ],
  "reference": {
    "kind": "td-extends",
    "target": "urn:example:thing:gateway",
    "minVersion": "1.2.0"
  },
  "expect": {
    "error": "unsatisfied"
  }
}
