{
  "description": "Generated allocation skips occupied ids, including an authored prerelease, but uses the lowest hole.",
  "registry": [
    {
      "wotid": "urn:example:pump:v1",
      "defaultversionsticky": false,
      "defaultversionid": "1.1.0",
      "versions": [
        {
          "versionid": "0.0.0-1",
          "versionorigin": "authored",
          "contentdigest": "sha256:0000000000000000000000000000000000000000000000000000000000000005",
          "version.model": "0.0.0-1"
        },
        {
          "versionid": "0.0.0-3",
          "versionorigin": "generated",
          "contentdigest": "sha256:0000000000000000000000000000000000000000000000000000000000000006"
        },
        {
          "versionid": "1.1.0",
          "versionorigin": "authored",
          "contentdigest": "sha256:0000000000000000000000000000000000000000000000000000000000000002",
          "version.model": "1.1.0"
        }
      ]
    }
  ],
  "publish": {
    "target": "urn:example:pump:v1",
    "version.model": "vendor-revision"
  },
  "expect": {
    "assigned": {
      "versionid": "0.0.0-2",
      "versionorigin": "generated",
      "defaultversionid": "1.1.0"
    }
  }
}
