{
  "description": "A missing sticky Version does not permit selecting a different Version.",
  "registry": [
    {
      "wotid": "urn:example:pump:v1",
      "defaultversionsticky": true,
      "defaultversionid": "1.9.0",
      "versions": [
        {
          "versionid": "1.0.0",
          "versionorigin": "authored",
          "contentdigest": "sha256:0000000000000000000000000000000000000000000000000000000000000001",
          "version.model": "1.0.0"
        },
        {
          "versionid": "1.1.0",
          "versionorigin": "authored",
          "contentdigest": "sha256:0000000000000000000000000000000000000000000000000000000000000002",
          "version.model": "1.1.0"
        }
      ]
    }
  ],
  "reference": {
    "kind": "extends",
    "target": "urn:example:pump:v1"
  },
  "expect": {
    "error": "not-found"
  }
}
