{
  "description": "With several fully specified links version.model raises each link's explicit floor.",
  "registry": [
    {
      "wotid": "urn:example:pump:v1",
      "defaultversionsticky": false,
      "defaultversionid": "1.1.0",
      "versions": [
        {
          "versionid": "1.0.0",
          "versionorigin": "authored",
          "contentdigest": "sha256:0000000000000000000000000000000000000000000000000000000000000001",
          "version.model": "1.0.0"
        },
        {
          "versionid": "1.1.0",
          "versionorigin": "authored",
          "contentdigest": "sha256:0000000000000000000000000000000000000000000000000000000000000002",
          "version.model": "1.1.0"
        }
      ]
    }
  ],
  "reference": {
    "kind": "type",
    "target": "urn:example:pump:v1",
    "minVersion": "1.0.0"
  },
  "document": {
    "typeLinks": [
      {
        "target": "urn:example:pump:v1",
        "minVersion": "1.0.0"
      },
      {
        "target": "urn:example:device:v1",
        "minVersion": "1.0.0"
      }
    ],
    "version.model": "1.2.0"
  },
  "expect": {
    "error": "unsatisfied"
  }
}
